{
  "schema_version": "1.0",
  "catalog_id": "cti_asm_hypothesis_templates",
  "catalog_version": "1",
  "templates": [
    {
      "template_id": "credential_progression_v1",
      "template_version": "1",
      "subject_kind": "identity",
      "match_kinds": ["identity_service"],
      "recipe_file": "credential_to_critical_path_v1.json",
      "window_steps": 20,
      "description": "後段検知のbaseline・整合性比較用。credential利用→横展開→重要経路接近の既存recipeを、漏洩identityのscopeに限定して実行する。"
    },
    {
      "template_id": "critical_path_v1",
      "template_version": "1",
      "subject_kind": "node",
      "match_kinds": ["endpoint_exact", "identity_service"],
      "recipe_file": "critical_path_approach_v1.json",
      "window_steps": 20,
      "description": "確認済みassetに観測inventoryで対応付くnodeについて、重要経路接近の派生signalを数える。派生signalを使う限界がある。"
    },
    {
      "template_id": "identity_lateral_v1",
      "template_version": "1",
      "subject_kind": "identity",
      "match_kinds": ["identity_service"],
      "recipe_file": "identity_process_chain_v1.json",
      "window_steps": 20,
      "description": "identity–service matchの漏洩identityについて、認証成功→観測process→横展開の系列を追う。"
    }
  ]
}
